{
  "canblog": 0,
  "canprint": 1,
  "candownload": 1,
  "size": [
    {
      "label": "Original",
      "width": 6048,
      "height": 4032,
      "source": "https://live.staticflickr.com/65535/52345678901_abc1234def_o.jpg",
      "url": "https://www.flickr.com/galleries/12345678@N00/72157712345/",
      "media": "photo"
    }
  ]
}